{
  "schema_version": "se-decision-conditions-package-v0.1",
  "protocol_version": "SE-DECISION-CONDITIONS-v0.1",
  "project": "SE-DUAL-SITE-UPGRADE-002",
  "phase": "C",
  "baseline_main_sha": "bbced95da00ed259e942aa63ebd89d93f70c54a0",
  "generated_from_review_time": "2026-10-25T02:59:00Z",
  "content_hash_algorithm": "SHA-256 over RFC-8785-style sorted compact JSON; snapshot_sha256 excluded from its own input",
  "public_capability_status": "ILLUSTRATIVE_PUBLIC_EXPORT",
  "commercial_integration_status": "PROPOSED_NOT_LIVE",
  "conditions": [
    {
      "decision_condition_id": "SE-DC-CML-PDRE-001-OEG-CML-001-v0.1",
      "version": "v0.1",
      "previous_snapshot_sha256": null,
      "supersedes_decision_condition_id": null,
      "stable_urls": {
        "html": "https://structurevidence.org/cases/800vdc/decision-conditions/#SE-DC-CML-PDRE-001-OEG-CML-001-v0.1",
        "json": "https://structurevidence.org/cases/800vdc/decision-conditions-v0.1.json",
        "markdown": "https://structurevidence.org/cases/800vdc/decision-conditions-v0.1.md#se-dc-cml-pdre-001-oeg-cml-001-v0.1",
        "gap": "https://structurevidence.org/gaps/OEG-CML-001/"
      },
      "case_id": "CML-PDRE-001",
      "gap_id": "OEG-CML-001",
      "claim_id": "CML-PDRE-001.INDEPENDENT_VALIDATION",
      "decision_type": "ILLUSTRATIVE_TECHNICAL_QUALIFICATION",
      "decision_context_status": "PUBLIC_ILLUSTRATION_NOT_CLIENT_ADOPTION",
      "scope": {
        "question": "Does an independent attributable field record validate the named 800VDC deployment claim under the active rule?",
        "bounded_sample": "Nine actual URLs in the bounded repository source packets; not a market census.",
        "reviewed_url_count": 9,
        "distinct_lineage_count": 7,
        "authority_status": "TIME_BOUNDED_REVIEW_RESULT_NOT_AUTHORITATIVE_TRUTH"
      },
      "current_evidence_state": {
        "case_state": "HUMAN-REVIEWED SINGLE-INSTANCE EVIDENCE",
        "case_state_as_of": "2026-09-20T10:46:47Z",
        "state_changed_by_export": false,
        "interpretation": "A time-bounded reviewed state, not authoritative truth and not a client action."
      },
      "time_boundary": {
        "evidence_cutoff": "2026-10-22T14:02:00Z",
        "last_source_check_at": "2026-10-22T14:02:00Z",
        "reviewed_at": "2026-10-25T02:59:00Z"
      },
      "source_evidence_rule": {
        "qualification_rule_id": "SE-SD-QR-OEG-CML-001-INDEPENDENT-VALIDATION-v0.2",
        "rubric_version": "SE-SOURCE-DEPENDENCY-RUBRIC-v0.2",
        "minimum_evidence_level": "E4",
        "permitted_dependency_classes": [
          "ISSUER_AUTHORED",
          "PARTIALLY_DEPENDENT",
          "INDEPENDENT"
        ],
        "permitted_originator_roles": [
          "OPERATOR",
          "REGULATOR",
          "RESEARCHER",
          "OTHER"
        ],
        "required_evidence_facets": [
          "NAMED_SITE",
          "OBSERVATION_PERIOD",
          "OPERATING_CONDITIONS",
          "METHODOLOGY",
          "RESPONSIBLE_ORGANIZATION"
        ],
        "rule_text": "Qualifying evidence must be an independently attributable operating or test record tied to the named site with observation period, conditions, method, and responsible organization. An operator record can qualify only when its attributable methodology is present; dependency remains separately visible.",
        "exact_closure_test": "A qualifying row must meet the active dependency-class, E4-or-higher, operator/site/architecture/operation/date, and attributable-method requirements.",
        "acceptable_source_types": {
          "originator_roles": [
            "OPERATOR",
            "REGULATOR",
            "RESEARCHER",
            "OTHER"
          ],
          "dependency_classes": [
            "ISSUER_AUTHORED",
            "PARTIALLY_DEPENDENT",
            "INDEPENDENT"
          ],
          "minimum_level": "E4",
          "all_required_facets_must_be_present": true
        }
      },
      "source_evidence_result": {
        "qualification_outcome": "NOT_QUALIFIED_WITHIN_BOUNDED_REVIEW",
        "qualifying_evidence_present": false,
        "qualifying_evidence": [],
        "nonqualifying_evidence": [
          {
            "source_row_id": "SE-SOURCE-ROW-CML-PDRE-001-INDEPENDENT-VALIDATION-CHINDATA-533-V2",
            "source_record_hash": "4952ec928a5e3e8ece9353baf970a68432c04d7148e2771f38dadac55201bbcc",
            "title": "Chindata commercial-operation announcement for Sangyuan campus",
            "url": "https://www.chindatagroup.com/media/news/533.html",
            "capture_sha256": "57e1ede12822f29e973c66d11db60a2e55a429cd4b7a4fea4bcc44d1c8aa1918",
            "originator_id": "ORIGINATOR-CHINDATA",
            "originator_role": "OPERATOR",
            "dependency_class": "ISSUER_AUTHORED",
            "originating_evidence_lineage": [],
            "evidence_level": "E3",
            "evidence_facets": [
              "NAMED_OPERATOR",
              "NAMED_SITE",
              "MATERIALLY_COMPARABLE_ARCHITECTURE",
              "COMMISSIONED_OR_OPERATING",
              "EVENT_DATE",
              "RESPONSIBLE_ORGANIZATION"
            ],
            "qualification_status": "NOT_QUALIFIED",
            "qualification_reason": "E3 is below the rule minimum E4.",
            "source_access_status": "READ_PARTIAL",
            "supersedes_source_row_id": "SE-SOURCE-ROW-CML-PDRE-001-INDEPENDENT-VALIDATION-CHINDATA-533-V1"
          },
          {
            "source_row_id": "SE-SOURCE-ROW-CML-PDRE-001-INDEPENDENT-VALIDATION-PI-IDEAL-SSCB-20261012-V1",
            "source_record_hash": "22945d3d35754e9aa50f1c870a83080009b39293932fb8c605a16e2b067eec90",
            "title": "Power Integrations and Ideal Power 800 VDC SSCB collaboration",
            "url": "https://investors.power.com/news/news-details/2026/Power-Integrations-and-Ideal-Power-Collaborate-on-Efficient-Always-On-Solid-State-Circuit-Breakers-for-800-VDC-AI-Data-Centers/default.aspx",
            "capture_sha256": "bc53bc00c4a66d044af3e69d461ba6c0d2164a8625939be56e90dc4f6b9c2ed9",
            "originator_id": "ORIGINATOR-POWER-INTEGRATIONS-IDEAL-POWER",
            "originator_role": "SUPPLIER",
            "dependency_class": "ISSUER_AUTHORED",
            "originating_evidence_lineage": [],
            "evidence_level": "E2",
            "evidence_facets": [
              "RESPONSIBLE_ORGANIZATION",
              "EVENT_DATE"
            ],
            "qualification_status": "NOT_QUALIFIED",
            "qualification_reason": "E2 is below the rule minimum E4.",
            "source_access_status": "READ_PARTIAL",
            "supersedes_source_row_id": null
          },
          {
            "source_row_id": "SE-SOURCE-ROW-CML-PDRE-001-INDEPENDENT-VALIDATION-SIEMENS-REINHAUSEN-2026-V1",
            "source_record_hash": "c59361d911cb6712c03a5e4e9321c02890876984f01386f9c9c63fa054bf46cf",
            "title": "Siemens and Reinhausen develop DC power solutions for AI data centers",
            "url": "https://press.siemens.com/global/en/pressrelease/siemens-and-reinhausen-develop-direct-current-power-solutions-ai-data-centers",
            "capture_sha256": "8f7827b87ec928420c44e012492416e3f08940d1aeb106f9ce8210014a9a0fdc",
            "originator_id": "ORIGINATOR-SIEMENS-REINHAUSEN",
            "originator_role": "SUPPLIER",
            "dependency_class": "ISSUER_AUTHORED",
            "originating_evidence_lineage": [],
            "evidence_level": "E1",
            "evidence_facets": [
              "MATERIALLY_COMPARABLE_ARCHITECTURE",
              "RESPONSIBLE_ORGANIZATION",
              "EVENT_DATE"
            ],
            "qualification_status": "NOT_QUALIFIED",
            "qualification_reason": "E1 is below the rule minimum E4.",
            "source_access_status": "READ_PARTIAL",
            "supersedes_source_row_id": null
          },
          {
            "source_row_id": "SE-SOURCE-ROW-CML-PDRE-001-INDEPENDENT-VALIDATION-SOLAREDGE-BUSINESSWIRE-20261013-V1",
            "source_record_hash": "3c10e7ff1d0a28f9c7f00f2cb8bad19a7037e0367d24fd45f4cf39d1a0575c04",
            "title": "Business Wire distribution copy of the SolarEdge announcement",
            "url": "https://www.businesswire.com/news/home/20261013444026/en/",
            "capture_sha256": "34fe5c45ce6eb0f9c29521c6ea7a596ce62a93af4607f56619749733385b0950",
            "originator_id": "ORIGINATOR-SOLAREDGE",
            "originator_role": "SUPPLIER",
            "dependency_class": "DERIVED",
            "originating_evidence_lineage": [
              "SE-SOURCE-ROW-CML-PDRE-001-INDEPENDENT-VALIDATION-SOLAREDGE-ORIGIN-20261013-V1"
            ],
            "evidence_level": "E2",
            "evidence_facets": [
              "MATERIALLY_COMPARABLE_ARCHITECTURE",
              "RESPONSIBLE_ORGANIZATION",
              "EVENT_DATE"
            ],
            "qualification_status": "NOT_QUALIFIED",
            "qualification_reason": "E2 is below the rule minimum E4.",
            "source_access_status": "READ_PARTIAL",
            "supersedes_source_row_id": null
          },
          {
            "source_row_id": "SE-SOURCE-ROW-CML-PDRE-001-INDEPENDENT-VALIDATION-SOLAREDGE-ORIGIN-20261013-V1",
            "source_record_hash": "4357702468ee88b6e5e861a8f60340944fbf7564c52b0c3d8cddfc8517214443",
            "title": "SolarEdge MVAC-to-800 VDC technology showcase announcement",
            "url": "https://solaredge.gcs-web.com/news-releases/news-release-details/solaredge-showcases-mvac-800-vdc-ai-factory-power-technology",
            "capture_sha256": "34fe5c45ce6eb0f9c29521c6ea7a596ce62a93af4607f56619749733385b0950",
            "originator_id": "ORIGINATOR-SOLAREDGE",
            "originator_role": "SUPPLIER",
            "dependency_class": "ISSUER_AUTHORED",
            "originating_evidence_lineage": [],
            "evidence_level": "E2",
            "evidence_facets": [